{
  "schemaVersion": 1,
  "id": "m5-visual-performance",
  "benchmarkKind": "presentation-only",
  "protocol": {
    "warmupSeconds": 10,
    "sampleSeconds": 60,
    "viewportWidth": 1600,
    "viewportHeight": 900,
    "deviceScaleFactor": 1,
    "maximumRecordedFramesPerSecond": 240
  },
  "scenarios": [
    {
      "id": "visual-normal",
      "seed": 1398100558,
      "activePearlCount": 300,
      "fireSize": 100,
      "interactionGroupCount": 4,
      "pearlTypeWeights": {
        "medicinalLiquid": 0.5,
        "slag": 0.3,
        "impurity": 0.2
      },
      "motion": {
        "horizontalAmplitudePixels": 8,
        "verticalAmplitudePixels": 7,
        "cyclesPerSecond": 0.3
      },
      "effectSchedule": {
        "steamPerSecond": 24,
        "shieldPerSecond": 12,
        "damagePerSecond": 8,
        "fightPerSecond": 4
      },
      "requiredEffectKinds": ["steam", "shield", "damage", "fight"],
      "effectPool": {
        "initialCapacity": 640,
        "maximumCapacity": 1024
      },
      "audio": {
        "enabled": true,
        "cueIntervalMilliseconds": 220
      },
      "thresholds": {
        "minimumFramesPerCompleteSecond": 59,
        "minimumInteractionGroupCount": 4,
        "maximumDroppedEffectCount": 0,
        "minimumAudioVoiceHighWaterMark": 1,
        "maximumTrackedFrameAllocationCount": 0
      }
    },
    {
      "id": "visual-stress",
      "seed": 1448301652,
      "activePearlCount": 900,
      "fireSize": 100,
      "interactionGroupCount": 4,
      "pearlTypeWeights": {
        "medicinalLiquid": 0.5,
        "slag": 0.3,
        "impurity": 0.2
      },
      "motion": {
        "horizontalAmplitudePixels": 8,
        "verticalAmplitudePixels": 7,
        "cyclesPerSecond": 0.3
      },
      "effectSchedule": {
        "steamPerSecond": 36,
        "shieldPerSecond": 18,
        "damagePerSecond": 12,
        "fightPerSecond": 4
      },
      "requiredEffectKinds": ["steam", "shield", "damage", "fight"],
      "effectPool": {
        "initialCapacity": 1024,
        "maximumCapacity": 1536
      },
      "audio": {
        "enabled": true,
        "cueIntervalMilliseconds": 180
      },
      "thresholds": {
        "minimumFramesPerCompleteSecond": 45,
        "minimumInteractionGroupCount": 4,
        "maximumDroppedEffectCount": 0,
        "minimumAudioVoiceHighWaterMark": 1,
        "maximumTrackedFrameAllocationCount": 0
      }
    }
  ]
}
